{
  "id": "org-cipa",
  "type": "organization",
  "org_kind": "trade_association",
  "name": "California Independent Petroleum Association",
  "summary": [
    {
      "id": "s1",
      "text": "Dette er en forening for uavhengige oljeselskaper. De har brukt om lag 700 000 dollar på lobbyvirksomhet i sesjonen 2025–2026.",
      "status": "confirmed",
      "note": "",
      "sources": [
        {
          "url": "https://dbsearch.sos.ca.gov/LobbyIntSearch.aspx",
          "title": "Cal-Access Lobbyist Employer Category Search, sesjon 2025-2026, database oppdatert 28-OCT-2026 08:15:07",
          "publisher": "California Secretary of State",
          "retrieved": "2026-10-28",
          "archive_url": "http://web.archive.org/web/20250525150615/https://dbsearch.sos.ca.gov/LobbyIntSearch.aspx",
          "archive_note": "Wayback availability 2026-10-28 fant et øyeblikksbilde."
        }
      ]
    },
    {
      "id": "s2",
      "text": "De står i samme oljekategori som Chevron og oljeorganisasjonen WSPA.",
      "status": "confirmed",
      "note": "Det er ikke bekreftet at 40 er et absolutt tak i databasen. Listen som kom tilbake, begynner på Berry og slutter på Woodside og inneholder både de største og nullbeløp.",
      "sources": [
        {
          "url": "https://dbsearch.sos.ca.gov/LobbyIntSearch.aspx",
          "title": "Cal-Access Lobbyist Employer Category Search, sesjon 2025-2026, database oppdatert 28-OCT-2026 08:15:07",
          "publisher": "California Secretary of State",
          "retrieved": "2026-10-28",
          "archive_url": "http://web.archive.org/web/20250525150615/https://dbsearch.sos.ca.gov/LobbyIntSearch.aspx",
          "archive_note": "Wayback availability 2026-10-28 fant et øyeblikksbilde."
        }
      ]
    },
    {
      "id": "s3",
      "text": "Vi har ikke koblet foreningen til en bestemt brønn eller en bestemt lovavstemning ut over lobbytallet.",
      "status": "not_found",
      "note": "ContributorSearch er ikke kjørt for CIPA.",
      "sources": [
        {
          "url": "https://dbsearch.sos.ca.gov/LobbyIntSearch.aspx",
          "title": "Cal-Access Lobbyist Employer Category Search, sesjon 2025-2026, database oppdatert 28-OCT-2026 08:15:07",
          "publisher": "California Secretary of State",
          "retrieved": "2026-10-28",
          "archive_url": "http://web.archive.org/web/20250525150615/https://dbsearch.sos.ca.gov/LobbyIntSearch.aspx",
          "archive_note": "Wayback availability 2026-10-28 fant et øyeblikksbilde."
        }
      ]
    }
  ],
  "claims": [
    {
      "id": "c1",
      "text": "Filer-id i postback fra søket er 1146650, og interessekoden er OIL AND GAS.",
      "status": "confirmed",
      "note": "",
      "sources": [
        {
          "url": "https://dbsearch.sos.ca.gov/LobbyIntSearch.aspx",
          "title": "Cal-Access Lobbyist Employer Category Search, sesjon 2025-2026, database oppdatert 28-OCT-2026 08:15:07",
          "publisher": "California Secretary of State",
          "retrieved": "2026-10-28",
          "archive_url": "http://web.archive.org/web/20250525150615/https://dbsearch.sos.ca.gov/LobbyIntSearch.aspx",
          "archive_note": "Wayback availability 2026-10-28 fant et øyeblikksbilde."
        }
      ]
    },
    {
      "id": "kept-s1",
      "text": "Cal-Access-filer 1146650, California Independent Petroleum Association (CIPA), har 744 330,97 dollar i lobbybetalinger i sesjonen 2025-2026, kategori oil and gas.",
      "status": "confirmed",
      "note": "",
      "sources": [
        {
          "url": "https://dbsearch.sos.ca.gov/LobbyIntSearch.aspx",
          "title": "Cal-Access Lobbyist Employer Category Search, sesjon 2025-2026, database oppdatert 28-OCT-2026 08:15:07",
          "publisher": "California Secretary of State",
          "retrieved": "2026-10-28",
          "archive_url": "http://web.archive.org/web/20250525150615/https://dbsearch.sos.ca.gov/LobbyIntSearch.aspx",
          "archive_note": "Wayback availability 2026-10-28 fant et øyeblikksbilde."
        }
      ]
    },
    {
      "id": "kept-s2",
      "text": "Foreningen står i samme uttrekk som Chevron, WSPA og California Resources. Uttrekket ga 40 employer-rader i kategorien, sortert alfabetisk, inkludert rader med 0 dollar.",
      "status": "confirmed",
      "note": "Det er ikke bekreftet at 40 er et absolutt tak i databasen. Listen som kom tilbake, begynner på Berry og slutter på Woodside og inneholder både de største og nullbeløp.",
      "sources": [
        {
          "url": "https://dbsearch.sos.ca.gov/LobbyIntSearch.aspx",
          "title": "Cal-Access Lobbyist Employer Category Search, sesjon 2025-2026, database oppdatert 28-OCT-2026 08:15:07",
          "publisher": "California Secretary of State",
          "retrieved": "2026-10-28",
          "archive_url": "http://web.archive.org/web/20250525150615/https://dbsearch.sos.ca.gov/LobbyIntSearch.aspx",
          "archive_note": "Wayback availability 2026-10-28 fant et øyeblikksbilde."
        }
      ]
    },
    {
      "id": "kept-s3",
      "text": "Ingen brønn, ingen lovtekst og ingen bidragssum er knyttet til CIPA ut over lobbytallet.",
      "status": "not_found",
      "note": "ContributorSearch er ikke kjørt for CIPA.",
      "sources": [
        {
          "url": "https://dbsearch.sos.ca.gov/LobbyIntSearch.aspx",
          "title": "Cal-Access Lobbyist Employer Category Search, sesjon 2025-2026, database oppdatert 28-OCT-2026 08:15:07",
          "publisher": "California Secretary of State",
          "retrieved": "2026-10-28",
          "archive_url": "http://web.archive.org/web/20250525150615/https://dbsearch.sos.ca.gov/LobbyIntSearch.aspx",
          "archive_note": "Wayback availability 2026-10-28 fant et øyeblikksbilde."
        }
      ]
    }
  ],
  "geometry": null,
  "map_features": [],
  "links": [
    {
      "rel": "problem",
      "target_id": "ca-problem-oil-gas-proximity",
      "text": "Lobby i samme kategori som produsentene."
    }
  ],
  "checked_empty": [
    {
      "field": "campaign_contributions",
      "searched": "ContributorSearch er ikke kjørt for CALIFORNIA INDEPENDENT PETROLEUM.",
      "result": "not_found",
      "urls": [
        "https://dbsearch.sos.ca.gov/ContributorSearch.aspx"
      ],
      "retrieved": "2026-10-28"
    }
  ],
  "open_questions": [
    "Hvilke lovforslag CIPA oppga i siste Form 635."
  ],
  "state": "CA",
  "updated": "2026-10-28",
  "rank": null,
  "schema_version": "1.0.0"
}
