{
  "schema_version": "1.0.0",
  "id": "lawmaker-buffy-wicks",
  "type": "lawmaker",
  "name": "Buffy Wicks",
  "state": "CA",
  "updated": "2026-10-28",
  "rank": null,
  "org_kind": null,
  "summary": [
    {
      "id": "s1",
      "text": "Buffy Wicks er demokrat. Hun sitter i forsamlingen for deler av Alameda og Contra Costa, ved raffineriene øst for bukta. Håndboken sier at hun har sittet siden desember 2018.",
      "status": "confirmed",
      "note": "",
      "sources": [
        {
          "url": "https://www.senate.ca.gov/system/files/2026-09/joint_handbook_2025-26_web_1.pdf",
          "title": "California Legislature Handbook 2025-26",
          "publisher": "California State Senate",
          "retrieved": "2026-10-28",
          "archive_url": "",
          "archive_note": "PDF-en er lest 2026-10-28. Wayback er ikke slått opp."
        }
      ]
    },
    {
      "id": "s2",
      "text": "Hun stemte ja til loven om avstand mellom oljebrønner og hus.",
      "status": "confirmed",
      "note": "",
      "sources": [
        {
          "url": "https://leginfo.legislature.ca.gov/faces/billVotesClient.xhtml?bill_id=202120220SB1137",
          "title": "Stemmeliste sb1137",
          "publisher": "California Legislative Counsel",
          "retrieved": "2026-10-28",
          "archive_url": "http://web.archive.org/web/20250920054954/https://leginfo.legislature.ca.gov/faces/billVotesClient.xhtml?bill_id=202120220SB1137",
          "archive_note": "Leginfo svarte 403 direkte. Listen er lest i arkivet."
        }
      ]
    },
    {
      "id": "s3",
      "text": "Hun stemte ja til loven om lager av drivstoff ved raffineriene.",
      "status": "confirmed",
      "note": "",
      "sources": [
        {
          "url": "https://leginfo.legislature.ca.gov/faces/billVotesClient.xhtml?bill_id=202320242AB1",
          "title": "Stemmeliste abx2",
          "publisher": "California Legislative Counsel",
          "retrieved": "2026-10-28",
          "archive_url": "http://web.archive.org/web/20260308020621/https://leginfo.legislature.ca.gov/faces/billVotesClient.xhtml?bill_id=202320242AB1",
          "archive_note": "Leginfo svarte 403 direkte. Listen er lest i arkivet."
        }
      ]
    },
    {
      "id": "s4",
      "text": "I uttrekket av gaver fra oljeselskapene vi søkte, står ikke navnet hennes.",
      "status": "confirmed",
      "note": "",
      "sources": [
        {
          "url": "https://campaignfinance.cdn.sos.ca.gov/dbwebexport.zip",
          "title": "CAL-ACCESS LCCM_CD, uttrekk 28. oktober 2026",
          "publisher": "California Secretary of State",
          "retrieved": "2026-10-28",
          "archive_url": "http://web.archive.org/web/20260930110449/https://campaignfinance.cdn.sos.ca.gov/dbwebexport.zip",
          "archive_note": "Gaven er en rad i tabellen, koblet til giveren via regnskapsforsiden."
        }
      ]
    }
  ],
  "claims": [
    {
      "id": "c1",
      "text": "Tallene og datoene står i stemmelisten og i håndboken. Sammendraget over er de samme faktaene med vanlige ord.",
      "status": "confirmed",
      "note": "",
      "sources": [
        {
          "url": "https://www.senate.ca.gov/system/files/2026-09/joint_handbook_2025-26_web_1.pdf",
          "title": "California Legislature Handbook 2025-26",
          "publisher": "California State Senate",
          "retrieved": "2026-10-28",
          "archive_url": "",
          "archive_note": "PDF-en er lest 2026-10-28. Wayback er ikke slått opp."
        }
      ]
    }
  ],
  "links": [
    {
      "rel": "problem",
      "target_id": "ca-problem-refineries",
      "text": "Ja til drivstofflager."
    },
    {
      "rel": "problem",
      "target_id": "ca-problem-oil-gas-proximity",
      "text": "Ja til avstand fra brønner."
    },
    {
      "rel": "bill",
      "target_id": "bill-sb-1137",
      "text": "Ja-stemmen."
    }
  ],
  "geometry": {
    "type": "Polygon",
    "coordinates": [
      [
        [
          -122.4416,
          37.9724
        ],
        [
          -122.3475,
          38.0733
        ],
        [
          -122.2252,
          38.061
        ],
        [
          -122.2537,
          38.0142
        ],
        [
          -122.2096,
          37.9962
        ],
        [
          -122.2711,
          37.9398
        ],
        [
          -122.1574,
          37.818
        ],
        [
          -122.2435,
          37.8187
        ],
        [
          -122.2661,
          37.852
        ],
        [
          -122.3559,
          37.8357
        ],
        [
          -122.4416,
          37.9724
        ]
      ]
    ],
    "source_name": "US Census TIGERweb 2024",
    "source_record_id": "06014",
    "source_url": "https://tigerweb.geo.census.gov/arcgis/rest/services/TIGERweb/Legislative/MapServer/6/query",
    "retrieved": "2026-10-28",
    "note": "Valgkretsen AD 14 fra folketellingen i 2024. Det er området personen representerer, ikke området med forurensning."
  },
  "map_features": [],
  "checked_empty": [
    {
      "field": "public_statement",
      "searched": "En egen pressemelding ut over den som er sitert i sammendraget, er ikke åpnet for denne personen i denne runden.",
      "result": "not_found",
      "urls": [
        "https://www.senate.ca.gov/system/files/2026-09/joint_handbook_2025-26_web_1.pdf"
      ],
      "retrieved": "2026-10-28"
    }
  ],
  "open_questions": []
}
