{
  "id": "bill-sb-1168",
  "type": "bill",
  "name": "SB 1168 (2013-2014), grunnvann",
  "summary": [
    {
      "id": "s1",
      "text": "SB 1168, kapittel 346, godkjent 16. september 2014. Forfatter på statussiden er Pavley. Loven legger til del 2.74 i Water Code.",
      "status": "confirmed",
      "note": "",
      "sources": [
        {
          "url": "https://leginfo.legislature.ca.gov/faces/billStatusClient.xhtml?bill_id=201320140SB1168",
          "title": "SB 1168 status",
          "publisher": "Legislative Counsel",
          "retrieved": "2026-10-28",
          "archive_url": "http://web.archive.org/web/20250321055920/https://leginfo.legislature.ca.gov/faces/billStatusClient.xhtml?bill_id=201320140SB1168",
          "archive_note": "Wayback availability 2026-10-28 fant et øyeblikksbilde."
        }
      ]
    },
    {
      "id": "s2",
      "text": "Senatet samtykket i forsamlingens endringer 29. august 2014 med 25 mot 10. Forsamlingen vedtok lovforslaget samme dag med 47 mot 27.",
      "status": "confirmed",
      "note": "",
      "sources": [
        {
          "url": "https://leginfo.legislature.ca.gov/faces/billHistoryClient.xhtml?bill_id=201320140SB1168",
          "title": "SB 1168 history",
          "publisher": "Legislative Counsel",
          "retrieved": "2026-10-28",
          "archive_url": "http://web.archive.org/web/20250315214258/https://leginfo.legislature.ca.gov/faces/billHistoryClient.xhtml?bill_id=201320140SB1168",
          "archive_note": "Wayback availability 2026-10-28 fant et øyeblikksbilde."
        }
      ]
    },
    {
      "id": "s3",
      "text": "Pavley står på ja-listen i senatets samtykkevotering.",
      "status": "confirmed",
      "note": "",
      "sources": [
        {
          "url": "https://leginfo.legislature.ca.gov/faces/billVotesClient.xhtml?bill_id=201320140SB1168",
          "title": "SB 1168 votes",
          "publisher": "Legislative Counsel",
          "retrieved": "2026-10-28",
          "archive_url": "http://web.archive.org/web/20250314163210/https://leginfo.legislature.ca.gov/faces/billVotesClient.xhtml?bill_id=201320140SB1168",
          "archive_note": "Wayback availability 2026-10-28 fant et øyeblikksbilde."
        }
      ]
    },
    {
      "id": "s4",
      "text": "Ingen Cal-Access-filing som er lest, sier at en navngitt lobbyvirksomhet oppga SB 1168. Loven er fra 2014. Skjemaene som er åpnet, er fra 2025.",
      "status": "not_found",
      "note": "",
      "sources": [
        {
          "url": "https://dbsearch.sos.ca.gov/LobbyIntSearch.aspx",
          "title": "Cal-Access lobbying search",
          "publisher": "California Secretary of State",
          "retrieved": "2026-10-28",
          "archive_url": "http://web.archive.org/web/20250525150615/https://dbsearch.sos.ca.gov/LobbyIntSearch.aspx",
          "archive_note": "Wayback availability 2026-10-28 fant et øyeblikksbilde."
        }
      ]
    }
  ],
  "claims": [
    {
      "id": "c1",
      "text": "Første senatsvotering 27. mai 2014 var 24 mot 12.",
      "status": "confirmed",
      "note": "",
      "sources": [
        {
          "url": "https://leginfo.legislature.ca.gov/faces/billHistoryClient.xhtml?bill_id=201320140SB1168",
          "title": "SB 1168 history",
          "publisher": "Legislative Counsel",
          "retrieved": "2026-10-28",
          "archive_url": "http://web.archive.org/web/20250315214258/https://leginfo.legislature.ca.gov/faces/billHistoryClient.xhtml?bill_id=201320140SB1168",
          "archive_note": "Wayback availability 2026-10-28 fant et øyeblikksbilde."
        }
      ]
    }
  ],
  "links": [
    {
      "rel": "problem",
      "target_id": "ca-problem-groundwater-overdraft",
      "text": "SGMA-rammen."
    },
    {
      "rel": "lawmaker",
      "target_id": "lawmaker-fran-pavley",
      "text": "Forfatter."
    },
    {
      "rel": "bill",
      "target_id": "bill-ab-1739",
      "text": "Vedtatt samme dag."
    },
    {
      "rel": "bill",
      "target_id": "bill-sb-1319",
      "text": "Vedtatt samme dag."
    }
  ],
  "open_questions": [
    "Hvem som lobbet på SB 1168 i 2014. Det krever sesjonen 2013–2014 i Cal-Access, som ikke er åpnet."
  ],
  "state": "CA",
  "updated": "2026-10-28",
  "rank": null,
  "org_kind": null,
  "geometry": null,
  "map_features": [],
  "checked_empty": [],
  "schema_version": "1.0.0"
}
