{
  "id": "lawmaker-lena-gonzalez",
  "type": "lawmaker",
  "name": "Lena A. Gonzalez",
  "summary": [
    {
      "id": "plain-1",
      "text": "Lena Gonzalez er senator for distrikt 33, som dekker deler av Los Angeles fylke, blant annet Long Beach. Hun la fram loven om avstand mellom oljebrønner og boliger.",
      "status": "confirmed",
      "note": "",
      "sources": [
        {
          "url": "https://www.senate.ca.gov/senators/33",
          "title": "District 33 Details, Lena A. Gonzalez",
          "publisher": "California State Senate",
          "retrieved": "2026-10-28",
          "archive_url": "https://web.archive.org/web/20261028154328/https://www.senate.ca.gov/senators/33",
          "archive_note": "Save Page Now 2026-10-28 opprettet et øyeblikksbilde."
        },
        {
          "url": "https://sd33.senate.ca.gov/district",
          "title": "Senate District 33",
          "publisher": "Office of Senator Lena A. Gonzalez",
          "retrieved": "2026-10-28",
          "archive_url": "http://web.archive.org/web/20261012231409/https://sd33.senate.ca.gov/district",
          "archive_note": "Wayback availability 2026-10-28 fant et øyeblikksbilde."
        },
        {
          "url": "https://leginfo.legislature.ca.gov/faces/billStatusClient.xhtml?bill_id=202120220SB1137",
          "title": "SB 1137 status",
          "publisher": "California Legislative Counsel",
          "retrieved": "2026-10-28",
          "archive_url": "http://web.archive.org/web/20250920055105/https://leginfo.legislature.ca.gov/faces/billStatusClient.xhtml?bill_id=202120220SB1137",
          "archive_note": "Wayback availability 2026-10-28 fant et øyeblikksbilde."
        }
      ]
    },
    {
      "id": "plain-2",
      "text": "Hun stemte ja da senatet vedtok den loven. Avstemningen var 25 mot 10.",
      "status": "confirmed",
      "note": "",
      "sources": [
        {
          "url": "https://leginfo.legislature.ca.gov/faces/billVotesClient.xhtml?bill_id=202120220SB1137",
          "title": "SB 1137 bill votes",
          "publisher": "California Legislative Counsel",
          "retrieved": "2026-10-28",
          "archive_url": "http://web.archive.org/web/20250920054954/https://leginfo.legislature.ca.gov/faces/billVotesClient.xhtml?bill_id=202120220SB1137",
          "archive_note": "Wayback availability 2026-10-28 fant et øyeblikksbilde."
        }
      ]
    },
    {
      "id": "plain-3",
      "text": "Distriktet dekker Southeast Los Angeles, Long Beach og havnen, ifølge hennes egen side.",
      "status": "confirmed",
      "note": "",
      "sources": [
        {
          "url": "https://sd33.senate.ca.gov/district",
          "title": "Senate District 33",
          "publisher": "Office of Senator Lena A. Gonzalez",
          "retrieved": "2026-10-28",
          "archive_url": "http://web.archive.org/web/20261012231409/https://sd33.senate.ca.gov/district",
          "archive_note": "Wayback availability 2026-10-28 fant et øyeblikksbilde."
        }
      ]
    }
  ],
  "claims": [
    {
      "id": "c1",
      "text": "Senatssiden oppgir at hun sitter i Environmental Quality. Komitélisten er lest som verv, ikke som en påstand om hvordan hun stemmer i komiteen.",
      "status": "confirmed",
      "note": "",
      "sources": [
        {
          "url": "https://www.senate.ca.gov/senators/33",
          "title": "District 33 Details, Lena A. Gonzalez",
          "publisher": "California State Senate",
          "retrieved": "2026-10-28",
          "archive_url": "https://web.archive.org/web/20261028154328/https://www.senate.ca.gov/senators/33",
          "archive_note": "Save Page Now 2026-10-28 opprettet et øyeblikksbilde."
        }
      ]
    },
    {
      "id": "s1",
      "text": "Senatets distriktsside oppgir Lena A. Gonzalez som senator for distrikt 33, med capitol-kontor i 1021 O Street, Suite 7510, Sacramento.",
      "status": "confirmed",
      "note": "",
      "sources": [
        {
          "url": "https://www.senate.ca.gov/senators/33",
          "title": "District 33 Details, Lena A. Gonzalez",
          "publisher": "California State Senate",
          "retrieved": "2026-10-28",
          "archive_url": "https://web.archive.org/web/20261028154328/https://www.senate.ca.gov/senators/33",
          "archive_note": "Save Page Now 2026-10-28 opprettet et øyeblikksbilde."
        }
      ]
    },
    {
      "id": "s2",
      "text": "Distriktsbeskrivelsen på senatorens side omfatter Southeast Los Angeles, Long Beach og havnen, Lakewood, Signal Hill og Catalina Island.",
      "status": "confirmed",
      "note": "",
      "sources": [
        {
          "url": "https://sd33.senate.ca.gov/district",
          "title": "Senate District 33",
          "publisher": "Office of Senator Lena A. Gonzalez",
          "retrieved": "2026-10-28",
          "archive_url": "http://web.archive.org/web/20261012231409/https://sd33.senate.ca.gov/district",
          "archive_note": "Wayback availability 2026-10-28 fant et øyeblikksbilde."
        }
      ]
    },
    {
      "id": "s3",
      "text": "Leginfo oppgir henne som lead author på SB 1137, sammen med Limón.",
      "status": "confirmed",
      "note": "",
      "sources": [
        {
          "url": "https://leginfo.legislature.ca.gov/faces/billStatusClient.xhtml?bill_id=202120220SB1137",
          "title": "SB 1137 status",
          "publisher": "California Legislative Counsel",
          "retrieved": "2026-10-28",
          "archive_url": "http://web.archive.org/web/20250920055105/https://leginfo.legislature.ca.gov/faces/billStatusClient.xhtml?bill_id=202120220SB1137",
          "archive_note": "Wayback availability 2026-10-28 fant et øyeblikksbilde."
        }
      ]
    },
    {
      "id": "s4",
      "text": "Hun står på ja-siden i senatets samtykkevotering 31. august 2022, 25 mot 10.",
      "status": "confirmed",
      "note": "",
      "sources": [
        {
          "url": "https://leginfo.legislature.ca.gov/faces/billVotesClient.xhtml?bill_id=202120220SB1137",
          "title": "SB 1137 bill votes",
          "publisher": "California Legislative Counsel",
          "retrieved": "2026-10-28",
          "archive_url": "http://web.archive.org/web/20250920054954/https://leginfo.legislature.ca.gov/faces/billVotesClient.xhtml?bill_id=202120220SB1137",
          "archive_note": "Wayback availability 2026-10-28 fant et øyeblikksbilde."
        }
      ]
    }
  ],
  "geometry": null,
  "map_features": [],
  "links": [
    {
      "rel": "bill",
      "target_id": "bill-sb-1137",
      "text": "Forfatter."
    },
    {
      "rel": "problem",
      "target_id": "ca-problem-oil-gas-proximity",
      "text": "Loven om helsesoner."
    }
  ],
  "checked_empty": [
    {
      "field": "campaign_contributions",
      "searched": "ContributorSearch er ikke kjørt med mottaker Lena Gonzalez. Giver-søkene over er ikke koblet til henne.",
      "result": "not_found",
      "urls": [
        "https://dbsearch.sos.ca.gov/"
      ],
      "retrieved": "2026-10-28"
    }
  ],
  "open_questions": [
    "Hvor mye hun mottok fra olje- og gassfiler i 2022 og senere. Det krever et mottakersøk, ikke giversummene alene."
  ],
  "state": "CA",
  "updated": "2026-10-28",
  "rank": null,
  "org_kind": null,
  "schema_version": "1.0.0"
}
