{
  "id": "firm-greenberg-traurig",
  "type": "lobbying_firm",
  "name": "Greenberg Traurig, LLP",
  "summary": [
    {
      "id": "s1",
      "text": "WSPAs Form 635 for andre kvartal 2025 fører Greenberg Traurig, LLP, Sacramento, med 37 500,00 dollar this period og 75 000,00 dollar kumulativt.",
      "status": "confirmed",
      "note": "",
      "sources": [
        {
          "url": "https://cal-access.sos.ca.gov/PDFGen/pdfgen.prg?amendid=0&filingid=3070933",
          "title": "Form 635 filing 3070933, Western States Petroleum Association, 2025-04-01 til 2025-06-30",
          "publisher": "California Secretary of State",
          "retrieved": "2026-10-28",
          "archive_url": "http://web.archive.org/web/20251002191218/https://cal-access.sos.ca.gov/PDFGen/pdfgen.prg?filingid=3070933&amendid=0",
          "archive_note": "Wayback availability 2026-10-28 fant et øyeblikksbilde."
        }
      ]
    },
    {
      "id": "s2",
      "text": "Beløpet er det WSPA betalte, ikke firmaets samlede omsetning.",
      "status": "confirmed",
      "note": "",
      "sources": [
        {
          "url": "https://cal-access.sos.ca.gov/PDFGen/pdfgen.prg?amendid=0&filingid=3070933",
          "title": "Form 635 filing 3070933, Western States Petroleum Association, 2025-04-01 til 2025-06-30",
          "publisher": "California Secretary of State",
          "retrieved": "2026-10-28",
          "archive_url": "http://web.archive.org/web/20251002191218/https://cal-access.sos.ca.gov/PDFGen/pdfgen.prg?filingid=3070933&amendid=0",
          "archive_note": "Wayback availability 2026-10-28 fant et øyeblikksbilde."
        }
      ]
    },
    {
      "id": "s3",
      "text": "Andre klienter er ikke hentet.",
      "status": "not_found",
      "note": "",
      "sources": [
        {
          "url": "https://cal-access.sos.ca.gov/PDFGen/pdfgen.prg?amendid=0&filingid=3070933",
          "title": "Form 635 filing 3070933, Western States Petroleum Association, 2025-04-01 til 2025-06-30",
          "publisher": "California Secretary of State",
          "retrieved": "2026-10-28",
          "archive_url": "http://web.archive.org/web/20251002191218/https://cal-access.sos.ca.gov/PDFGen/pdfgen.prg?filingid=3070933&amendid=0",
          "archive_note": "Wayback availability 2026-10-28 fant et øyeblikksbilde."
        }
      ]
    }
  ],
  "claims": [
    {
      "id": "c1",
      "text": "Fees-kolonnen i uttrekket er 37 500,00 og reimbursements 0,00.",
      "status": "confirmed",
      "note": "",
      "sources": [
        {
          "url": "https://cal-access.sos.ca.gov/PDFGen/pdfgen.prg?amendid=0&filingid=3070933",
          "title": "Form 635 filing 3070933, Western States Petroleum Association, 2025-04-01 til 2025-06-30",
          "publisher": "California Secretary of State",
          "retrieved": "2026-10-28",
          "archive_url": "http://web.archive.org/web/20251002191218/https://cal-access.sos.ca.gov/PDFGen/pdfgen.prg?filingid=3070933&amendid=0",
          "archive_note": "Wayback availability 2026-10-28 fant et øyeblikksbilde."
        }
      ]
    }
  ],
  "geometry": null,
  "map_features": [],
  "links": [
    {
      "rel": "organization",
      "target_id": "org-wspa",
      "text": "Oppdragsgiver i det kvartalet."
    }
  ],
  "checked_empty": [
    {
      "field": "other_clients",
      "searched": "Firmaregisteret er ikke slått opp.",
      "result": "not_found",
      "urls": [
        "https://dbsearch.sos.ca.gov/LobbyFirmsSearch.aspx"
      ],
      "retrieved": "2026-10-28"
    }
  ],
  "open_questions": [
    "Klientlisten for 2025-2026."
  ],
  "state": "CA",
  "updated": "2026-10-28",
  "rank": null,
  "org_kind": null,
  "schema_version": "1.0.0"
}
