{
  "schema_version": "1.0.0",
  "id": "lawmaker-mike-gipson",
  "type": "lawmaker",
  "name": "Mike A. Gipson",
  "state": "CA",
  "updated": "2026-10-28",
  "rank": null,
  "org_kind": null,
  "summary": [
    {
      "id": "s1",
      "text": "Mike A. Gipson er demokrat. Han sitter i forsamlingen for et område sør i Los Angeles, nær havn og raffineri. Håndboken sier at han har sittet siden desember 2014.",
      "status": "confirmed",
      "note": "",
      "sources": [
        {
          "url": "https://www.senate.ca.gov/system/files/2026-09/joint_handbook_2025-26_web_1.pdf",
          "title": "California Legislature Handbook 2025-26",
          "publisher": "California State Senate",
          "retrieved": "2026-10-28",
          "archive_url": "",
          "archive_note": "PDF-en er lest 2026-10-28. Wayback er ikke slått opp."
        }
      ]
    },
    {
      "id": "s2",
      "text": "Han stemte ja til loven om avstand mellom oljebrønner og hus.",
      "status": "confirmed",
      "note": "",
      "sources": [
        {
          "url": "https://leginfo.legislature.ca.gov/faces/billVotesClient.xhtml?bill_id=202120220SB1137",
          "title": "Stemmeliste sb1137",
          "publisher": "California Legislative Counsel",
          "retrieved": "2026-10-28",
          "archive_url": "http://web.archive.org/web/20250920054954/https://leginfo.legislature.ca.gov/faces/billVotesClient.xhtml?bill_id=202120220SB1137",
          "archive_note": "Leginfo svarte 403 direkte. Listen er lest i arkivet."
        }
      ]
    },
    {
      "id": "s3",
      "text": "Marathon ga 3 500 dollar til valgkampen hans 26. september 2024, altså etter ja-stemmen i 2022.",
      "status": "confirmed",
      "note": "",
      "sources": [
        {
          "url": "https://campaignfinance.cdn.sos.ca.gov/dbwebexport.zip",
          "title": "CAL-ACCESS LCCM_CD, uttrekk 28. oktober 2026",
          "publisher": "California Secretary of State",
          "retrieved": "2026-10-28",
          "archive_url": "http://web.archive.org/web/20260930110449/https://campaignfinance.cdn.sos.ca.gov/dbwebexport.zip",
          "archive_note": "Gaven er en rad i tabellen, koblet til giveren via regnskapsforsiden."
        }
      ]
    },
    {
      "id": "s4",
      "text": "På den endelige avstemningen om lokal kontroll med olje i 2024 stemte han ikke.",
      "status": "confirmed",
      "note": "",
      "sources": [
        {
          "url": "https://leginfo.legislature.ca.gov/faces/billVotesClient.xhtml?bill_id=202320240AB3233",
          "title": "Stemmeliste ab3233",
          "publisher": "California Legislative Counsel",
          "retrieved": "2026-10-28",
          "archive_url": "http://web.archive.org/web/20250918105303/https://leginfo.legislature.ca.gov/faces/billVotesClient.xhtml?bill_id=202320240AB3233",
          "archive_note": "Leginfo svarte 403 direkte. Listen er lest i arkivet."
        }
      ]
    }
  ],
  "claims": [
    {
      "id": "c1",
      "text": "Tallene og datoene står i stemmelisten og i håndboken. Sammendraget over er de samme faktaene med vanlige ord.",
      "status": "confirmed",
      "note": "",
      "sources": [
        {
          "url": "https://www.senate.ca.gov/system/files/2026-09/joint_handbook_2025-26_web_1.pdf",
          "title": "California Legislature Handbook 2025-26",
          "publisher": "California State Senate",
          "retrieved": "2026-10-28",
          "archive_url": "",
          "archive_note": "PDF-en er lest 2026-10-28. Wayback er ikke slått opp."
        }
      ]
    }
  ],
  "links": [
    {
      "rel": "problem",
      "target_id": "ca-problem-refineries",
      "text": "Distriktet ligger ved havn og raffineri."
    },
    {
      "rel": "problem",
      "target_id": "ca-problem-oil-gas-proximity",
      "text": "Ja i 2022."
    },
    {
      "rel": "organization",
      "target_id": "org-marathon",
      "text": "Gaven kom etter 2022-stemmen."
    }
  ],
  "geometry": {
    "type": "Polygon",
    "coordinates": [
      [
        [
          -118.352,
          33.6666
        ],
        [
          -118.2798,
          33.7718
        ],
        [
          -118.3099,
          33.7819
        ],
        [
          -118.2915,
          33.9289
        ],
        [
          -118.234,
          33.9533
        ],
        [
          -118.1466,
          33.8603
        ],
        [
          -118.2849,
          33.8462
        ],
        [
          -118.2865,
          33.7976
        ],
        [
          -118.23,
          33.7925
        ],
        [
          -118.2266,
          33.8295
        ],
        [
          -118.249,
          33.7559
        ],
        [
          -118.2216,
          33.6906
        ],
        [
          -118.352,
          33.6666
        ]
      ]
    ],
    "source_name": "US Census TIGERweb 2024",
    "source_record_id": "06065",
    "source_url": "https://tigerweb.geo.census.gov/arcgis/rest/services/TIGERweb/Legislative/MapServer/6/query",
    "retrieved": "2026-10-28",
    "note": "Valgkretsen AD 65 fra folketellingen i 2024. Det er området personen representerer, ikke området med forurensning."
  },
  "map_features": [],
  "checked_empty": [
    {
      "field": "public_statement",
      "searched": "En egen pressemelding ut over den som er sitert i sammendraget, er ikke åpnet for denne personen i denne runden.",
      "result": "not_found",
      "urls": [
        "https://www.senate.ca.gov/system/files/2026-09/joint_handbook_2025-26_web_1.pdf"
      ],
      "retrieved": "2026-10-28"
    }
  ],
  "open_questions": []
}
